{
  "id": "storybook-local-verify",
  "role": "active-verify",
  "version": "10.6.1",
  "source_commit": "0000000000000000000000000000000000000000",
  "license": "MIT",
  "dependencies": {
    "sbom_ref": "bom/storybook-10.6.1.cyclonedx.json",
    "lockfile_ref": "package-lock.json",
    "direct": ["storybook@10.6.1", "@storybook/react@10.6.1", "@storybook/addon-a11y@10.6.1", "@storybook/test@10.6.1"]
  },
  "provides": ["a11y", "viewport", "interaction", "docs"],
  "requires_canonical": [
    {
      "artifact": "ui-flow/v1",
      "schema_version": "1.0.0",
      "fields": ["screen", "component", "state", "action", "intent", "acceptance"]
    }
  ],
  "mapping": [
    {"canonical_field": "screen.id", "adapter_field": "story.id", "rule": "direct", "unknown": "error"},
    {"canonical_field": "screen.title", "adapter_field": "story.title", "rule": "direct", "unknown": "error"},
    {"canonical_field": "component", "adapter_field": "story.component", "rule": "direct", "unknown": "error"},
    {"canonical_field": "state", "adapter_field": "story.args", "rule": "transform", "unknown": "error"},
    {"canonical_field": "action", "adapter_field": "story.play", "rule": "transform", "unknown": "error"},
    {"canonical_field": "acceptance", "adapter_field": "story.a11yChecks", "rule": "merge", "unknown": "error"}
  ],
  "owner": "ui-agent-skills-team",
  "reviewer": "zj",
  "lifecycle": "active",
  "fallback": {
    "on_failure": "local-verify",
    "on_network_loss": "static-preview",
    "on_remote_failure": "static-preview",
    "static_preview_ref": "preview/ui-flow.static.html",
    "local_verify_ref": "scripts/verify-local.sh"
  },
  "removal_test": {
    "invariants": [
      {"id": "R1", "description": "canonical artifact 仍可从本地 store 解析", "verify": "ui-flow/v1 解析测试不依赖本 adapter"},
      {"id": "R2", "description": "静态 preview 仍可构建/服务", "verify": "preview/ui-flow.static.html 构建命令退出码 0"},
      {"id": "R3", "description": "本地验证(a11y/interaction baseline)不依赖被删 adapter 仍可跑", "verify": "scripts/verify-local.sh 独立可跑"},
      {"id": "R4", "description": "活跃 manifest/plan 无指向被删 adapter 的悬空引用", "verify": "grep registry 无 storybook-local-verify 引用"},
      {"id": "R5", "description": "resolver 仍能解析体验或显式报 degraded", "verify": "resolver 解析返回 success 或 degraded，不崩溃"}
    ]
  },
  "reeval_date": "2027-01-20",
  "risk": [
    "Storybook 大版本升级须重跑 capability-fit 与 mapping 校验",
    "a11y addon 缺失时降级为 degraded，须标记缺口",
    "source_commit / sbom_ref / lockfile_ref 须在 1-7-3 集成时钉死（当前为占位）"
  ]
}
